{
  "schema_version": 2,
  "layout_id": "memory-grove-v5",
  "catalog_id": "memory-moon-style-v1",
  "catalog_version": 1,
  "projection_id": "isometric-orthographic-45-30",
  "terrain": {
    "columns": 36,
    "rows": 36,
    "cell_size": 0.333333,
    "tile_legend": {
      "g": "grass-moss-a"
    },
    "tile_rows": [
      "gggggggggggggggggggggggggggggggggggg",
      "gggggggggggggggggggggggggggggggggggg",
      "gggggggggggggggggggggggggggggggggggg",
      "gggggggggggggggggggggggggggggggggggg",
      "gggggggggggggggggggggggggggggggggggg",
      "gggggggggggggggggggggggggggggggggggg",
      "gggggggggggggggggggggggggggggggggggg",
      "gggggggggggggggggggggggggggggggggggg",
      "gggggggggggggggggggggggggggggggggggg",
      "gggggggggggggggggggggggggggggggggggg",
      "gggggggggggggggggggggggggggggggggggg",
      "gggggggggggggggggggggggggggggggggggg",
      "gggggggggggggggggggggggggggggggggggg",
      "gggggggggggggggggggggggggggggggggggg",
      "gggggggggggggggggggggggggggggggggggg",
      "gggggggggggggggggggggggggggggggggggg",
      "gggggggggggggggggggggggggggggggggggg",
      "gggggggggggggggggggggggggggggggggggg",
      "gggggggggggggggggggggggggggggggggggg",
      "gggggggggggggggggggggggggggggggggggg",
      "gggggggggggggggggggggggggggggggggggg",
      "gggggggggggggggggggggggggggggggggggg",
      "gggggggggggggggggggggggggggggggggggg",
      "gggggggggggggggggggggggggggggggggggg",
      "gggggggggggggggggggggggggggggggggggg",
      "gggggggggggggggggggggggggggggggggggg",
      "gggggggggggggggggggggggggggggggggggg",
      "gggggggggggggggggggggggggggggggggggg",
      "gggggggggggggggggggggggggggggggggggg",
      "gggggggggggggggggggggggggggggggggggg",
      "gggggggggggggggggggggggggggggggggggg",
      "gggggggggggggggggggggggggggggggggggg",
      "gggggggggggggggggggggggggggggggggggg",
      "gggggggggggggggggggggggggggggggggggg",
      "gggggggggggggggggggggggggggggggggggg",
      "gggggggggggggggggggggggggggggggggggg"
    ],
    "ground_plate": {
      "texture": "terrain/moonroot-ground-plate.png",
      "image_size_px": [1254, 1254],
      "world_size": [12, 12],
      "pixels_per_world_unit": 104.5,
      "projection": "top-down",
      "render_role": "authored-map-plate",
      "source_id": "imagegen-moonroot-ground-plate-20260801"
    }
  },
  "placements": [
    {"id": "HeroCommunityTree", "object": "community-tree-a", "layer": "back", "position": [-3.05, -3.8], "scale": 1.05, "flip_horizontal": false, "collision_enabled": true, "tags": ["hero", "landmark", "clearing"]},
    {"id": "HeroClearingFlowers", "object": "flower-patch-a", "layer": "back", "position": [-1.85, -4.35], "scale": 0.95, "flip_horizontal": false, "collision_enabled": false, "tags": ["accent", "clearing"]},
    {"id": "NorthRimBoulder", "object": "moss-boulder-a", "layer": "back", "position": [-4.8, -4.85], "scale": 0.9, "flip_horizontal": false, "collision_enabled": true, "tags": ["boundary", "cluster"]},
    {"id": "NorthEastSapling", "object": "moon-sapling-a", "layer": "back", "position": [3.95, -4.45], "scale": 0.9, "flip_horizontal": false, "collision_enabled": true, "tags": ["boundary", "canopy"]},
    {"id": "UpperRouteLamp", "object": "street-lamp-a", "layer": "back", "position": [-0.75, -2.4], "scale": 1.0, "flip_horizontal": false, "collision_enabled": true, "tags": ["path", "wayfinding"]},
    {"id": "NorthEastBush", "object": "moon-bush-round-a", "layer": "back", "position": [4.8, -3.5], "scale": 0.9, "flip_horizontal": false, "collision_enabled": true, "tags": ["boundary", "cluster"]},
    {"id": "EastBranchBush", "object": "moon-bush-round-a", "layer": "back", "position": [5.0, -2.1], "scale": 0.95, "flip_horizontal": false, "collision_enabled": true, "tags": ["boundary", "east-branch"]},
    {"id": "WestVillageWell", "object": "village-well-a", "layer": "middle", "position": [-3.1, 0.4], "scale": 1.05, "flip_horizontal": false, "collision_enabled": true, "tags": ["landmark", "water", "well-pocket"]},
    {"id": "WellPocketFlowers", "object": "flower-patch-a", "layer": "middle", "position": [-4.25, 0.85], "scale": 0.9, "flip_horizontal": false, "collision_enabled": false, "tags": ["accent", "well-pocket"]},
    {"id": "JunctionSign", "object": "trail-sign-a", "layer": "middle", "position": [-0.1, 2.35], "scale": 0.95, "flip_horizontal": false, "collision_enabled": true, "tags": ["wayfinding", "junction"]},
    {"id": "JunctionLamp", "object": "street-lamp-a", "layer": "middle", "position": [1.9, 1.35], "scale": 0.95, "flip_horizontal": false, "collision_enabled": true, "tags": ["path", "junction"]},
    {"id": "EastBranchBoulder", "object": "moss-boulder-a", "layer": "middle", "position": [3.8, 0.7], "scale": 0.95, "flip_horizontal": false, "collision_enabled": true, "tags": ["boundary", "east-branch"]},
    {"id": "WestPocketStump", "object": "tree-stump-a", "layer": "middle", "position": [-4.75, 1.75], "scale": 0.9, "flip_horizontal": false, "collision_enabled": true, "tags": ["obstacle", "cluster"]},
    {"id": "SouthWestBush", "object": "moon-bush-round-a", "layer": "front", "position": [-4.7, 4.0], "scale": 0.9, "flip_horizontal": false, "collision_enabled": true, "tags": ["boundary", "cluster"]},
    {"id": "SouthWestFlowers", "object": "flower-patch-a", "layer": "front", "position": [-3.35, 3.2], "scale": 0.9, "flip_horizontal": false, "collision_enabled": false, "tags": ["accent", "cluster"]},
    {"id": "SouthEastBoulder", "object": "moss-boulder-a", "layer": "front", "position": [4.15, 4.15], "scale": 1.0, "flip_horizontal": false, "collision_enabled": true, "tags": ["boundary", "cluster"]},
    {"id": "SouthEastSapling", "object": "moon-sapling-a", "layer": "front", "position": [5.0, 3.55], "scale": 0.9, "flip_horizontal": false, "collision_enabled": true, "tags": ["boundary", "canopy"]},
    {"id": "SouthGateFlowers", "object": "flower-patch-a", "layer": "front", "position": [0.35, 4.85], "scale": 0.9, "flip_horizontal": false, "collision_enabled": false, "tags": ["accent", "spawn"]}
  ],
  "boundaries": [
    {"id": "NorthBoundary", "position": [0, 0.5, -5.88], "size": [12, 1, 0.24]},
    {"id": "SouthBoundary", "position": [0, 0.5, 5.88], "size": [12, 1, 0.24]},
    {"id": "WestBoundary", "position": [-5.88, 0.5, 0], "size": [0.24, 1, 12]},
    {"id": "EastBoundary", "position": [5.88, 0.5, 0], "size": [0.24, 1, 12]}
  ],
  "spawn_points": [
    {"id": "player-default", "position": [1.9, 0, 5.4]}
  ],
  "critical_routes": [
    {"id": "south-to-hero-clearing", "points": [[1.9, 5.4], [1.37, 3.57], [0.75, 1.46], [0.12, -0.07], [-1.22, -1.69], [-2.25, -2.85]]},
    {"id": "junction-to-well-pocket", "points": [[0.75, 1.46], [-0.74, 1.66], [-2.0, 0.75]]},
    {"id": "junction-to-east-exit", "points": [[0.75, 1.46], [1.56, 0.32], [3.33, -0.45], [5.48, -1.07]]}
  ]
}
